{
  "_why": [
    "SEEDED 2026-09-09 by `node tooling/store/name-clearance.mjs Subly --app subscriptiontracker --execute`. Every verdict below was READ off a live endpoint on that run, with its red control green — controls.failed is empty, so nothing here is a downgraded guess.",
    "",
    "🔴 THE RECORD IS BLOCKED AND THAT IS THE POINT. Two live iOS listings carry the exact name Subly, one of them in Finance — the same category — and App Store names are GLOBALLY UNIQUE, so App Store Connect would refuse it. On 2026-09-09 the Microsoft Partner Center reserve-a-name dialog was one click from starting a three-month clock on it.",
    "",
    "WHY THE BUILD IS NOT RED TODAY, DERIVED AND NOT WAIVED. tooling/ci/assert-name-clearance.mjs weighs a wall against tooling/ci/channel-arming.mjs: ios-appstore and macos-appstore are `served: false` with `lane: null`, so neither can reach a user, and the guard PRINTS the finding on every run instead of blocking. The day a lane lands for either, this same unchanged record turns the guard red. Nothing has to be remembered for that to happen.",
    "",
    "The trademark ruling is OWED, not answered. subscriptiontracker.app resolves to a live commercial site in the same category, and no software can clear a trademark. `ruling: null` reads as QUALIFIED and prints as FAILING; its block is lifted only until gatedUntil, and --execute preserves that date rather than rewriting it, so a re-probe cannot extend its own gate."
  ],
  "app": "subscriptiontracker",
  "slug": "nikatrusubscriptiontracker",
  "name": {
    "value": "Nikatru Subscription Tracker",
    "asOf": "2026-09-09",
    "verify": "node tooling/store/name-clearance.mjs Nikatru Subscription Tracker --app subscriptiontracker --execute",
    "verifyKind": "remote"
  },
  "asOf": "2026-09-09",
  "channels": {
    "web": {
      "verdict": "PROVEN-FREE",
      "uniqueness": "none",
      "why": "No OTHER app in catalog/apps.json declares this name, and the web host is a subdomain of a wildcard this factory controls ([ADR 006]), so no external party can hold it. This is the one channel whose namespace is ours, which is why FREE is provable here and nowhere else.",
      "evidence": [
        "catalog/apps.json row \"subscriptiontracker\" carries this name — SELF, NOT A COLLISION, excluded from the comparison."
      ],
      "control": null
    },
    "android-play": {
      "verdict": "UNDETERMINED",
      "uniqueness": "tolerated",
      "why": "Play TOLERATES duplicate titles, so a title hit would be advisory rather than blocking — but the store search surface is JS-rendered with no unauthenticated API, so NO TITLE VERDICT can be proven here. The permanent applicationId is free of any PUBLISHED listing (control green, HTTP 404); a draft in somebody's console would not show. MANUAL/AUTHENTICATED STEP: a logged-in Play Console title check.",
      "evidence": [
        "apps/subscriptiontracker/android/app/build.gradle.kts declares com.nikatru.subscriptiontracker",
        "applicationId com.nikatru.subscriptiontracker — HTTP 404, no published listing holds it (control green)."
      ],
      "control": {
        "what": "play.google.com details?id=com.spotify.music (known present)",
        "green": true,
        "detail": "HTTP 200"
      }
    },
    "ios-appstore": {
      "verdict": "UNDETERMINED",
      "uniqueness": "global",
      "why": "No iOS listing carries this name (control green, 196 result(s) scanned). THIS IS NOT PROOF OF AVAILABILITY: the search index omits unreleased and name-reserved records, and Apple exposes no availability endpoint short of creating a record — which is forbidden here. MANUAL STEP: the App Store Connect new-app dialog, read and cancelled without saving.",
      "evidence": [],
      "control": {
        "what": "itunes.apple.com/lookup?bundleId=com.google.Gmail (known present: \"Gmail - Email by Google\")",
        "green": true,
        "detail": "HTTP 200, resultCount 1"
      }
    },
    "macos-appstore": {
      "verdict": "UNDETERMINED",
      "uniqueness": "global",
      "why": "No macOS listing carries this name (control green, 32 result(s) scanned). THIS IS NOT PROOF OF AVAILABILITY: the search index omits unreleased and name-reserved records, and Apple exposes no availability endpoint short of creating a record — which is forbidden here. MANUAL STEP: the App Store Connect new-app dialog, read and cancelled without saving.",
      "evidence": [],
      "control": {
        "what": "itunes.apple.com/lookup?bundleId=com.google.Gmail (known present: \"Gmail - Email by Google\")",
        "green": true,
        "detail": "HTTP 200, resultCount 1"
      }
    },
    "windows-store": {
      "verdict": "UNDETERMINED",
      "uniqueness": "tolerated",
      "why": "Microsoft TOLERATES duplicate display names, and the ONLY authority on a Store name is the Partner Center \"reserve a name\" dialog — pressing which IS the reservation, and starts a three-month submit-or-lose clock. That is a mutation and is refused here. MANUAL STEP, OWNER ONLY: open the reserve-name dialog, read the inline availability answer, and CANCEL without reserving.",
      "evidence": [
        "winget/Store catalogue substring search returned 0 rows (control green). ADVISORY only."
      ],
      "control": {
        "what": "storeedgefd manifestSearch KeyWord \"firefox\" (known non-empty)",
        "green": true,
        "detail": "HTTP 200, 2 row(s)"
      }
    },
    "windows-direct": {
      "verdict": "NOT-APPLICABLE",
      "uniqueness": "none",
      "why": "kind:\"direct\" — a download from a host this factory owns. No third party holds a name here; the only namespace is our own filename.",
      "evidence": [],
      "control": null
    },
    "linux-snap": {
      "verdict": "UNDETERMINED",
      "uniqueness": "global",
      "why": "No PUBLISHED snap holds \"nikatru-subscription-tracker\" (control green, HTTP 404). ⚠️ A name REGISTERED BUT UNPUBLISHED returns EXACTLY this same 404 — the snap namespace is claimed by registration, not by publication — so this is \"no published snap\", NOT \"registerable\". MANUAL STEP: `snapcraft register --dry-run nikatru-subscription-tracker` under the owner's account.",
      "evidence": [
        "https://api.snapcraft.io/v2/snaps/info/nikatru-subscription-tracker — HTTP 404"
      ],
      "control": {
        "what": "api.snapcraft.io/v2/snaps/info/firefox (known present)",
        "green": true,
        "detail": "HTTP 200"
      }
    },
    "linux-appimage": {
      "verdict": "NOT-APPLICABLE",
      "uniqueness": "none",
      "why": "kind:\"direct\" — an AppImage from a host this factory owns. No third-party name authority exists.",
      "evidence": [],
      "control": null
    },
    "apps-gov-in": {
      "verdict": "NOT-APPLICABLE",
      "uniqueness": "tolerated",
      "why": "The register declares `served: false`, `submittable: false` and no submission API — a manual web upload forever. There is no namespace to contest until a submission exists.",
      "evidence": [],
      "control": null
    },
    "chrome-webstore": {
      "verdict": "UNDETERMINED",
      "uniqueness": "tolerated",
      "why": "The Chrome Web Store has NO public search or name-availability API and its search surface is JS-rendered, so a fetch of it returns an empty body that must never be read as \"free\". Chrome tolerates duplicate names; what is permanent is the extension ID, which Google ASSIGNS — it is not chosen and cannot be checked in advance. MANUAL STEP: a logged-in developer-dashboard search plus a human read of the store search page.",
      "evidence": [],
      "control": null
    },
    "edge-addons": {
      "verdict": "UNDETERMINED",
      "uniqueness": "tolerated",
      "why": "Edge Add-ons exposes a details endpoint by CRX ID only — there is no name search API and no name-availability endpoint. Duplicates are tolerated. MANUAL STEP: the Partner Center (Edge program) submission form.",
      "evidence": [],
      "control": null
    },
    "amo": {
      "verdict": "PROVEN-FREE",
      "uniqueness": "tolerated",
      "why": "No listed Firefox add-on carries this name and the globally-unique slug \"nikatrusubscriptiontracker\" is unclaimed (control green, 0 row(s) searched).",
      "evidence": [],
      "control": {
        "what": "addons.mozilla.org search?q=ublock (known non-empty)",
        "green": true,
        "detail": "HTTP 200, count 2001"
      }
    }
  },
  "identifiers": [
    {
      "channel": "android-play",
      "kind": "gradle-application-id",
      "declaredIn": "apps/subscriptiontracker/android/app/build.gradle.kts",
      "value": "com.nikatru.subscriptiontracker",
      "verdict": "UNDETERMINED",
      "why": "apps/subscriptiontracker/android/app/build.gradle.kts declares com.nikatru.subscriptiontracker — bound PERMANENTLY at the first upload on this channel and never recycled, so this is the string that cannot be taken back. Play TOLERATES duplicate titles, so a title hit would be advisory rather than blocking — but the store search surface is JS-rendered with no unauthenticated API, so NO TITLE VERDICT can be proven here. The permanent applicationId is free of any PUBLISHED listing (control green, HTTP 404); a draft in somebody's console would not show. MANUAL/AUTHENTICATED STEP: a logged-in Play Console title check."
    },
    {
      "channel": "ios-appstore",
      "kind": "apple-bundle-id",
      "declaredIn": "apps/subscriptiontracker/ios/Runner.xcodeproj/project.pbxproj",
      "value": "com.nikatru.subscriptiontracker",
      "verdict": "UNDETERMINED",